#Título,Descripción
Passiu,"Element de l'estat financer del Balanç de Situació, juntament amb l'actiu, el qual recull les obligacions (no confondre amb obligacions en termes de comptabilitat pressupostària) de la corresponent organització. El passiu està conformat pels fons propis i els fons externs (creditors, préstecs,..)."
Perímetre de consolidació,"Delimitació concreta d'entitats que conformen conjunts d'unitats pel qual s'efectuarà la consolidació de comptes (pressupostària i financera)."
Polítiques de despesa,"2n nivell de desglossament i dígit de la classificació per programes del pressupost. Permet agrupar les despeses segons polítiques públiques o funcions diferenciades de l'administració."
Pressupost,"És el pla econòmic i financer anual vinculat a l’estratègia formulada pel Govern de Ciutat, esdevenint una eina clau per a la gestió pública, servint a la planificació, programació, control i seguiment i avaluació de les actuacions municipals. Té caràcter anual i conté les previsions d’ingressos que s’esperen obtenir i les despeses (crèdits pressupostaris) que com a màxim es podran realitzar en l’exercici corresponent."
Pressupost aprovat,"Projecte de pressupost que ha estat ratificat per la ple de la corporació i per tant, que pot entrar en vigor en el moment d'inici del corresponent exercici pressupostari."
Pressupost base de despeses,"És aquella estimació de recursos necessaris per tal de mantenir un nivell similar a l'actual quant a prestació de béns i serveis públics i poder fer front al compromisos ja adquirits. Aquest element forma part de les etapes en l'elaboració del pressupost."
Pressupost base d'ingressos,"És la projecció d’ingressos pel proper exercici pressupostari (exercici pel qual s'està elaborant el pressupost), considerant que les ordenances fiscals es mantenen constants. Aquest element forma part del procés d'elaboració del pressupost."
Pressupost ciutadà,"Document sintètic i explicatiu que acompanya els pressupostos, on s'expliquen de forma resumida i entenedora els principals concepte, trets i magnituds dels pressupostos municipals"
Pressupost consolidat,"El pressupost consolidat inclou tant el pressupost individual de l’Ajuntament, com el de les seves entitats dependents, essent l’agregació d’aquests (amb eliminació de les transferències internes) el pressupost consolidat del denominat “grup municipal”."
Pressupost definitiu,"És el resultat de l'aplicació al pressupost inicial de totes les modificacions que s'hi han realitzat al llarg de l'exercici pressupostari."
Pressupost Executiu,"És un sistema pressupostari que té per objecte vincular l’assignació i la gestió dels recursos pressupostaris amb l'estratègia (prioritats i resultats desitjats) de l’Ajuntament. En aquest sentit, aquest sistema pressupostari pretén avançar cap a la presa de decisions i gestió dels recursos públics basada en l'acompliment de l'estratègia municipal."
Pressupost inicial,"Correspon a les previsions d'ingressos i als crèdits de despesa consignats inicialment en els pressupostos aprovats."
Pressupost prorrogat,"Situació o mecanisme que davant la no aprovació d'un pressupost abans de l'inici del corresponent exercici, es prorroguen automàticament els ingressos i despeses inicials del darrer pressupost aprovat, incloent una sèrie d'ajustos determinats per la normativa."
Programa d'inversions municipal (PIM),"Programació plurianual dels projectes d'inversions concretats per a ser realitzats durant un mandat polític. El PIM és congruent amb el marc financer i es concreta anualment mitjançat els corresponents pressupostos anuals."
Programa d'Actuacions dels Districtes (PADs),"Document que recull les prioritats i actuacions i projectes estratègics dels corresponents districtes. Els PADs dels districtes han de ser congruents amb el PAM, el PIM i el marc financer municipal."
Programes pressupostaris,"Conjunt de béns, serveis i actuacions que tenen per finalitat aconseguir uns resultats concrets. Són les unitats bàsiques d'assignació i seguiment estratègic dels recursos pressupostaris. Els programes suposen el 4t dígit de la classificació pressupostària per programes"
Projecte de despesa,"Conjunt d'accions concretes de l'administració, programades i de caire no recurrent, que compten amb un inici i un final identificat. Els projectes formen una estructura pròpia (amb codificació pròpia) i no s'integren en cap classificació pressupostaria. Es defineixen projectes de despesa per a les despeses d'inversió."
Projecte de pressupost,"Proposta de pressupost elaborada i presentada per part del Govern de la ciutat, el qual inicia la seva tramitació plenària per a la seva aprovació final (pressupost aprovat). El pressupost finalment aprovat pot incorporar modificacions envers el projecte presentat, fruit d'esmenes i al·legacions i d'acords polítics."
Projectes d'inversió,"Unitat bàsica de concreció de les despeses d'inversió, la qual fa referència al conjunt de despeses que van associades a una actuació d'inversió concreta. L'estructura per projectes és una estructura pròpia i amb pròpia codificació. "
Regla de despesa,"Regla o objectiu fiscal derivat de la normativa en estabilitat pressupostària, el qual té per objecte la limitació del creixement anual de la despesa. La denominada “despesa computable” (principalment despesa no financera en termes consolidats i SEC, excloent la despesa en interessos i la despesa finançada amb ingressos finalistes), no pot créixer més d’un determinat % en relació a l’exercici anterior)."
Regles o objectius fiscals,"Regles o objectius de naturalesa pressupostària i financera (derivats normalment de la normativa en estabilitat pressupostària), envers els quals els pressupostos hi han de donar compliment, i que s'orienten cap a la fita d'assegurar l'estabilitat i sostenibilitat de les finances públiques."
Resultat pressupostari,"Forma part de l'Estat de liquidació del pressupost i és la diferència entre la totalitat dels drets pressupostaris nets liquidats en l'exercici i les obligacions pressupostàries netes reconegudes en el mateix període. Amb l'aplicació d'uns ajustos addicionals s'obté el resultat pressupostari ajustat."
Romanent de tresoreria,"Magnitud de naturalesa monetària o tresorera, que forma part dels estats pressupostaris anuals, la qual recull el valor resultant de sumar els fons líquids més els drets liquidats pendents de cobrar ajustats i restar el valor de les obligacions liquidades pendents de pagar. Aquesta magnitud informa sobre l'excedent o manca de finançament a curt termini de la corresponent entitat."
Sectors,"Agrupacions de gerències (i a la seva vegada de direccions) on cadascuna té designades unes competències de polítiques sectorials concretes. Els sectors es corresponen amb l'estructura executiva o gerencial de l'Ajuntament de Barcelona."
Sistema Europeu de Comptes (SEC),"Sistema de comptabilitat nacional, el qual serveix per valorar de forma homogènia els agregats i estats de les finances públiques dels països de la Unió Europea. És el sistema emprat pel càlcul i valoració dels resultats pressupostaris."
Subconcepte,"5è nivell de desglossament i dígit de la classificació econòmica del pressupost. Suposa el nivell de màxima desagregació o detall de la classificació econòmica."
Subprogrames,"Desglossament dels programes en línies d'actuació o de prestació de béns i serveis diferenciades dins dels programes pressupostaris. Els subprogrames suposen el 5è dígit de la classificació pressupostària per programes, i per tant, el seu màxim nivell de desglossament."
Superàvit,"Situació en què els ingressos no financers en termes SEC són superiors a les despeses no financeres en termes SEC, donant com a resultat una CNF amb signe positiu (és a dir, una capacitat de finançament)."
Tipologies de projectes d'inversió,"Classificació dels projectes d'inversió segons la seva orientació i finalitat concreta."
Transferències internes,"Transferències de recursos entre entitats que formen part d'un mateix grup organitzatiu o corporatiu."
Tresoreria,"Funció dins l'administració econòmica i financera d'una administració que té per objecte la planificació i gestió de l'estoc i els fluxos monetaris (cobraments i pagaments)."
Vinculació jurídica dels crèdits,"Vinculació d'un conjunt de crèdits pressupostaris, conformant una bossa de vinculació, on no es podrà executar despeses per valor superior a la suma dels crèdits que la conformen, però si que a nivell individual dels crèdits serà possible realitzar despeses per valor superior al import consignat."